{"format_version":1,"api_compat_hash":"266244ca65c75293","value_types":[{"spelling":"bool","json":"boolean"},{"spelling":"int","json":"integer"},{"spelling":"float","json":"number"},{"spelling":"string","json":"string"},{"spelling":"name","json":"string"},{"spelling":"vec2","json":"number_tuple","size":2},{"spelling":"vec3","json":"number_tuple","size":3},{"spelling":"vec4","json":"number_tuple","size":4},{"spelling":"quat","json":"number_tuple","size":4},{"spelling":"color","json":"number_tuple","size":4},{"spelling":"entity_ref","json":"string"},{"spelling":"asset_ref","json":"string"},{"spelling":"array","json":"array_of_element"},{"spelling":"map","json":"object_of_element"}],"events":[{"name":"trigger.entered","payload":[{"name":"trigger","type":"entity_ref"},{"name":"other","type":"entity_ref"}]},{"name":"trigger.exited","payload":[{"name":"trigger","type":"entity_ref"},{"name":"other","type":"entity_ref"}]},{"name":"contact.began","payload":[{"name":"self","type":"entity_ref"},{"name":"other","type":"entity_ref"},{"name":"position","type":"vec3"},{"name":"normal","type":"vec3"},{"name":"impulse","type":"float"}]},{"name":"contact.ended","payload":[{"name":"self","type":"entity_ref"},{"name":"other","type":"entity_ref"}]},{"name":"state.finished","payload":[{"name":"entity","type":"entity_ref"},{"name":"region","type":"name"},{"name":"state","type":"name"}]},{"name":"entity.spawned","payload":[{"name":"entity","type":"entity_ref"},{"name":"parent","type":"entity_ref"}]},{"name":"entity.despawned","payload":[{"name":"entity","type":"entity_ref"}]},{"name":"action.pressed","payload":[{"name":"action","type":"name"},{"name":"strength","type":"float"},{"name":"device","type":"int"}]},{"name":"action.released","payload":[{"name":"action","type":"name"},{"name":"device","type":"int"}]}],"expr_functions":[{"name":"int","params":["float"],"returns":"int"},{"name":"float","params":["int"],"returns":"float"},{"name":"abs","params":["float"],"returns":"float"},{"name":"sign","params":["float"],"returns":"float"},{"name":"floor","params":["float"],"returns":"float"},{"name":"ceil","params":["float"],"returns":"float"},{"name":"round","params":["float"],"returns":"float"},{"name":"trunc","params":["float"],"returns":"float"},{"name":"fract","params":["float"],"returns":"float"},{"name":"sqrt","params":["float"],"returns":"float"},{"name":"min","params":["float","float"],"returns":"float"},{"name":"max","params":["float","float"],"returns":"float"},{"name":"clamp","params":["float","float","float"],"returns":"float"},{"name":"saturate","params":["float"],"returns":"float"},{"name":"lerp","params":["float","float","float"],"returns":"float"},{"name":"vec2","params":["float","float"],"returns":"vec2"},{"name":"vec3","params":["float","float","float"],"returns":"vec3"},{"name":"vec4","params":["float","float","float","float"],"returns":"vec4"},{"name":"quat","params":["float","float","float","float"],"returns":"quat"},{"name":"dot","params":["vec3","vec3"],"returns":"float"},{"name":"cross","params":["vec3","vec3"],"returns":"vec3"},{"name":"length","params":["vec3"],"returns":"float"},{"name":"length_squared","params":["vec3"],"returns":"float"},{"name":"normalize","params":["vec3"],"returns":"vec3"},{"name":"distance","params":["vec3","vec3"],"returns":"float"},{"name":"distance_squared","params":["vec3","vec3"],"returns":"float"},{"name":"rotate","params":["quat","vec3"],"returns":"vec3"}],"formats":[]}
